{
  "type": "object",
  "properties": {
    "version": {
      "const": 1
    },
    "jobId": {
      "type": "string",
      "minLength": 1,
      "maxLength": 200
    },
    "conversationId": {
      "type": "string",
      "minLength": 1,
      "maxLength": 1024
    },
    "destination": {
      "type": "object",
      "properties": {
        "bridgeInstance": {
          "type": "string",
          "minLength": 1,
          "maxLength": 1024
        },
        "robotId": {
          "type": "string",
          "minLength": 1,
          "maxLength": 1024
        },
        "groupId": {
          "type": "string",
          "minLength": 1,
          "maxLength": 1024
        },
        "replyToMessageId": {
          "type": "string",
          "minLength": 1,
          "maxLength": 1024
        }
      },
      "required": [
        "bridgeInstance",
        "robotId",
        "groupId",
        "replyToMessageId"
      ],
      "additionalProperties": false
    },
    "content": {
      "type": "object",
      "properties": {
        "format": {
          "const": "markdown"
        },
        "text": {
          "type": "string",
          "minLength": 1
        }
      },
      "required": [
        "format",
        "text"
      ],
      "additionalProperties": false
    },
    "createdAt": {
      "type": "string",
      "format": "date-time"
    },
    "kind": {
      "enum": [
        "chat",
        "summary"
      ],
      "type": "string"
    }
  },
  "required": [
    "version",
    "jobId",
    "conversationId",
    "destination",
    "content",
    "createdAt"
  ],
  "additionalProperties": false,
  "$schema": "http://json-schema.org/draft-07/schema#",
  "title": "HuaJiBot local v1 reply-job"
}
